{
  "userId": "11111111-1111-4111-8111-111111111111",
  "hasProfile": true,
  "profile": {
    "id": "22222222-2222-4222-8222-222222222222",
    "user_id": "11111111-1111-4111-8111-111111111111",
    "full_name": "Nguyen Van An",
    "date_of_birth": "1990-01-01",
    "gender": "MALE"
  },
  "phone": {
    "phoneVerified": true,
    "maskedPhone": "+84******678"
  }
}
